{
  "schema_version": 1,
  "id": "jlcpcb_4layer",
  "name": "JLCPCB 4-Layer Standard",
  "description": "JLCPCB standard 4-layer stackup. 1.6mm total, 1oz outer copper, 0.5oz inner copper, FR4 TG130-140.",
  "vendor": "JLCPCB",
  "copper_layers": 4,
  "total_thickness_nm": 1600000,
  "dielectric_defaults": {
    "er": 4.4,
    "loss_tangent": 0.02,
    "material": "FR4 TG130-140"
  },
  "layers": [
    {
      "name": "F.Cu",
      "type": "copper",
      "thickness_nm": 35000,
      "copper_weight_oz": 1.0
    },
    {
      "name": "prepreg_1",
      "type": "dielectric",
      "thickness_nm": 200000,
      "dielectric": {
        "er": 4.4,
        "loss_tangent": 0.02,
        "material": "FR4 Prepreg 2116"
      }
    },
    {
      "name": "In1.Cu",
      "type": "copper",
      "thickness_nm": 17500,
      "copper_weight_oz": 0.5
    },
    {
      "name": "core",
      "type": "dielectric",
      "thickness_nm": 1090000,
      "dielectric": {
        "er": 4.4,
        "loss_tangent": 0.02,
        "material": "FR4 TG130-140 Core"
      }
    },
    {
      "name": "In2.Cu",
      "type": "copper",
      "thickness_nm": 17500,
      "copper_weight_oz": 0.5
    },
    {
      "name": "prepreg_2",
      "type": "dielectric",
      "thickness_nm": 200000,
      "dielectric": {
        "er": 4.4,
        "loss_tangent": 0.02,
        "material": "FR4 Prepreg 2116"
      }
    },
    {
      "name": "B.Cu",
      "type": "copper",
      "thickness_nm": 35000,
      "copper_weight_oz": 1.0
    }
  ]
}
